id,sentence,difficulty
3510,le chat a alors fait tomber la télécommande,A1
3511,sil vous plaît,A1
3512,il y a un quartier très agréable pour aller se balader,A1
3513,ma soeur sappelle laura elle a treize ans,A1
3514,alors voici ta chambre,A1
3515,des startup développent des solutions sur le thème de la reconnaissance tempsréel de formes dans une vidéo,C1
3516,le sansgêne la frime sont critiqués,B2
3517,lapproche des transformations socioéconomiques est aussi perçue à travers lévolution des activités et les mutations des structures démographiques qui aboutissent a de nouveaux contrastes géographiques,C2
3518,sur la table il y a un chat noir un petit livre un vase une assiette et un sac,A1
3519,nous buvons seulement de leau,A1
3520,il fumait un paquet de cigarettes par jour avant darrêter,A2
3521,il est bizarre ce chien,A1
3522,nous bénéficions tous de la couverture de toutes sortes de bienfaisantes et ingénieuses assurances mais plus nous avançons plus le combat contre la précarité simpose à nouveau,C2
3523,cest aussi le moment idéal pour profiter de leau et aller nager à la mer ou à la piscine,A1
3524,moi je veux aller au zoo et à laquarium et manger des glaces,A1
3525,je travaille dans une compagnie dassistance médicale en tant que médecin consultant pour la partie asiepacifique,B2
3526,aujourdhui la méthode est bien rodée,B1
3527,il vint lembrasser avant de rejoindre la cuisine,A2
3528,salut moi cest laura,A1
3529,et cétaient de longues discussions des disputes interminables au milieu desquelles je me glissais avec inquiétude et plaisir,B2
3530,le mardi ressemble au lundi sauf quil ny a pas dactivité après lécole david rentre chez lui pour faire ses devoirs et se reposer,A2
3531,jespère que tu passes de bonnes vacances à limoges,A2
3532,cest la question que se pose grégoire,A2
3533,trois français sur quatre sert favorables à ce que les pensions des fonctionnaires soient calculées sur les salaires des dix dernières années et non plus des six derniers mois comme aujourdhui contre 25 dans le privé,C2
3534,ce constat sappuie dabord sur des observations sur des animaux dits axéniques dont la flore intestinale est absente ce qui est le cas lorsque lanimal naît par césarienne,C2
3535,jattends votre réponse à bientôt,A1
3536,mes parents disent que lîle est très jolie  il y a de très belles plages on va pouvoir nager,A2
3537,si nous savions employer correctement votre langue maternelle nous trouverions du travail en un rien de temps,B2
3538,je travaille de 9 heures à 12 heures,A1
3539,vous procéderez au paiement sécurisé en ligne de lopération,B2
3540,ce peintre a été profondément choqué par la légèreté dans laquelle ce critique dart a parlé de son oeuvre,B2
3541,tu aimais te déguiser en princesse quand tu étais petite,A2
3542,lécologie est une pensée complexe qui contextualise toujours et toujours saisit les interactions et les rétroactions,C2
3543,on en doute,B1
3544,est ce que pouvez faire un fichier pdf quand tu as fait une histoire comme ça,B1
3545,monsieur le baron était un des plus puissants seigneurs de la westphalie car son château avait une porte et des fenêtres,B1
3546,tu es un vrai chef cuisinier,A1
3547,la réaction de floculation peut présenter diverses modalités dans le dosage de lantitoxine diphtérique ,C2
3548,telle étourdie par la gaieté des fidèles ivre de camaraderie de médisance et dassentiment mme verdurin juchée sur son perchoir pareille à un oiseau dont on eût trempé le colifichet dans du vin chaud sanglotait damabilité,C2
3549,ceci pourrait donner lieu à des jeux interactifs qui sont un excellent moyen de mémorisation,C2
3550,et cette joie ancienne mapportant la connaissance de ma présente misère une route bossuée qui pique une tête dans un creux où elle éparpille quelque cases  une route infatigable qui charge à fond de train un morne en haut duquel elle senlise brutalement dans une mare de maisons pataudes une route follement montant témérairement descendante et la carcasse de bois comiquement juchée sur de minuscules pattes de ciment que jappelle notre maison sa coiffure de tôle ondulant au soleil comme un peau qui sèche la salle à manger le plancher grossier où luisent de têtes de clous les solives de sapin et dombre qui courent au plafond les chaises de paille fantomales la lumière grise de la lampe celle vernissée et rapide des cancrelats qui bourdonne à faire mal ,C2
3551,elle ne travaille pas,A1
3552,cétait très intéressant,A2
3553,ils sengouffraient dans les sentiers puis se ruaient sur les arbres et tiraient sur leurs branches,B2
3554,même si on adore un livre il faut je pense accepter que certains passages du livre soient coupés ou modifiés car le travail décriture est complètement différent du travail dadaptation cinématographique,B2
3555,la société spacex conçoit construit et commercialise les lanceurs falcon 9 les moteurs merlin qui les propulsent ainsi que le vaisseau cargo dragon et sa version habitée le crew dragon,C1
3556,des parents qui narrivent pas à exercer pleinement leur autorité,B1
3557,selon lauteur les tests actuels encouragent les élèves à développer une pensée personnelle,B2
3558,il en résulte alors des conséquences désastreuses pour certaines espèces  pour le cerf on parle dune malformation de la mâchoire dune masse corporelle limitée dorganes sousdimensionnés et dune vie sexuée réduite,C1
3559,et il faut construire les marionnettes faire les costumes faire les décors faire la mise en scène faire les enregistrements,A2
3560,chez les gros utilisateurs cette communication comblerait un vide existentiel et contrecarrerait une vie sociale réelle insatisfaisante,C2
3561,parfois cette épreuve se passe mal entre autonomie et dépendance entre succès et échecs,B2
3562,en plus de son rôle si important pour la recherche en génétique et en biologie moléculaire de pourvoyeur de quantité illimitée dadn à partir dun infime échantillon la pcr savérera un outil indispensable notamment au diagnostic de plusieurs maladies et à la génétique forensique,C2
3563,elle génère donc un espace où se manifestent des modes dexpression très divers en fonction des projets de séances qui présentent plus ou moins dimprovisation ou de mise en forme ainsi quen fonction de la variabilité et de la composition des groupes,C2
3564,cependant dans certains cas les exploitants veulent rentabiliser leur concession au maximum et dans des délais beaucoup trop courts dun point de vue écologique,B2
3565,on mange à 20 heures ou plus tard,A1
3566,laurine courait maintenant sabandonnait tout à fait au plaisir de ce jeu nouveau et la figure rose elle se précipitait dun grand élan denfant ravie à chacune des fuites à chacune des ruses à chacune des feintes de son compagnon,C2
3567,catherine navebekhti secrétaire générale du sgencfdt  juge cette nouvelle interdiction inutile,B2
3568,eviter dimporter de linflation et surtout contrôler le niveau de change du franc suisse par rapport aux grandes devises internationales et notamment face à leuro et au dollar,C1
3569,quoique brève notre entrevue a été productive,B2
3570,il y a essentiellement trois grandes catégories,B2
3571,il a les yeux marron,A1
3572,je suis allé la voir dès que jai appris quelle avait des problèmes,B1
3573,le matin où à la suite dune orgie il se trouva décidément volé il acheta deux beaux chevaux prit pour domestique un ancien soldat palefrenier du maquignon et dans son mépris pour les jeunes parisiens beaux parleurs partit pour larmée,C1
3574,nous devons nous envisager autant comme citoyens du monde que comme héritiers dune vieille nation,C2
3575,elle a 21 ans,A1
3576,de plus ce dernier doit apprendre à bien tenir son chien pour permettre à lanimal de bien le conduire,B1
3577,conservation ou exploitation ,B2
3578,en entendant la porte dentrée souvrir elle leva les yeux de lordinateur et aperçut son mari,B1
3579,les industriels ont entrepris des recherches pour améliorer les procédés de fabrication les rendre moins énergivores et limiter les déchets à la source mais la question des matériaux déjà existants se pose aujourdhui bien que les besoins ne soient pas immédiats,C2
3580,je suis né à toronto,A1
3581,dans cette série tv connue pour inspirer les geeks de tout âge et toute nationalité le holodeck est une espèce de salle de jeu capable de matérialiser nimporte quel environnement apparemment sans nécessiter aucune interface particulière,C1
3582,jai détesté la littérature à lécole en plus de ça,A2
3583,de plus certaines limitations sont également apparues en termes de puissance ou bien de permis de conduire,B2
3584,jhabite à paris,A1
3585,je suis papa,A1
3586,le bulletin de notes du gouvernement a piètre allure,B2
3587,jaime beaucoup cette exposition,A1
3588,toutes ses velléités de dénigrement sévanouissaient sous la poésie du rôle qui lenvahissait et entraînée vers lhomme par lillusion du personnage elle tâcha de se figurer sa vie cette vie rétentissante extraordinaire splendide et quelle aurait pu mener cependant si le hasard lavait voulu,C2
3589,gros bisous et merci beaucoup pour cette nouvelle histoire,A2
3590,suite à une série de retards cet employé a été mis à pied pour une durée indertéminée,C2
3591,ils vont habiter tous les deux dans un joli appartement à paris,A2
3592,aussitôt que vous eûtes résolu ce problème vous partîtes,C2
3593,le public na pas reconnu son talent,A2
3594,et la grande personne était bien contente de connaître un homme aussi raisonnable,B1
3595,mais il y a un problème ,A1
3596,malheureusement on voit souvent la capacité à parler anglais comme une force mais pas forcément dautres langues regrette madame,B1
3597,les linguistes estiment quun idiome ne peut survivre quà condition de compter au moins 100 000 locuteurs,C1
3598,les éternels affrontements entre ceux qui militent pour la protection inconditionnelle de sanctuaires naturels et ceux qui défendent les intérêts économiques des compagnies forestières semblent même passés de mode,B2
3599,occasionnellement kassák ment sur ses intentions sa profession ou sa confession  il se dit ainsi juif pour bénéficier dune caisse dentraide juive autre réseau élaboré à léchelle européenne et manque de se faire démasquer lorsquil tient son livre de prières à lenvers ou peine à retenir les quelques lignes de prière apprises phonétiquement,C2
3600,cest peutêtre une petite soeur un gentil chat comme moi ,A1
3601,audelà de la pression réglementaire les entreprises qui sengagent dans le recyclage des déchets professionnels sinquiètent de la diminution des matières premières qui entrent dans la composition de ces appareils  des métaux rares du cuivre du fer,B2
3602,ils permirent ainsi pour le meilleur et pour le pire cette grande transformation qui multiplia les productions et autorisa laugmentation colossale de lespèce humaine,C2
3603,cest vraiment dommage que les gens ne fasse pas attention à ce quils consomment,B1
3604,nous parlons français lorsque nous sommes dehors à lécole ou au marché,A1
3605,ils rentrèrent au pays après quils eurent vécu en europe,C2
3606,ils nont tout simplement aucune classe,B1
3607,cest à la fin du xixe siècle que les scientifiques commencent à sintéresser de manière raisonnée  aux capacités intellectuelles des hommes et des femmes,B2
3608,en me levant ce matin javais très mal à la tête,B1
3609,jadore lodeur du napalm au petit matin,B2
3610,comme un rappel du massacre des quelque 60 millions de bisons orchestré à la fin du xixe siècle pour venir à bout des peauxrouges,C1
3611,ted ce sont des conférences au cours desquelles les intervenants doivent parler pendant 20 minutes sans notes,B2
3612,déplorant que le sénat ait préféré au contraire en rester aux dispositions initiales du projet de loi il a conclu en constatant quil semblait dans ces conditions difficile de trouver une conciliation permettant daboutir à un accord en commission mixte paritaire,C2
3613,à cette occasion les parents cachent des oeufs en chocolat dans la maison et le jardin et les enfants samusent à les chercher,A2
3614,on a droit à tout sauf à la qualité,B1
3615,tout est prêt,A1
3616,ma contrainte avec lui eut une grande influence sur mon caractère,B2
3617,en allemagne luniversité de potsdam donne aux réfugiés qui ont été enseignants dans leur pays dorigine la possibilité de devenir assistants puis professeurs dans les écoles allemandes qui manquent denseignants,B2
3618,tout le chapelet de sociétés effectivement connectées dont lantiquité méditerranéenne puis leurope médiévale ne formaient que lextrémité occidentale ne peut plus apparaître uniquement comme un ensemble danciennes civilisations plus ou moins rétives à la modernité objets de lorientalisme,C2
3619,cest dans cette voie  ouverte entre la timidité aristotélicienne et laudace insensée des alchimistes  quallait passer toute la science de lavenir,C2
3620,malgré les progrès accomplis la situation alimentaire mondiale reste donc préoccupante surtout si on la met en relation avec les données démographiques,C1
3621,comme sa valise est trop petite il demande à hélène si elle veut toujours bien lui en prêter une  il peut venir la chercher chez elle puisquils nhabitent pas loin lun de lautre,A2
3622,la vapeur se contournait en spirales autour des groupes de palmiers entre lesquels apparaissaient de pittoresques bungalows,B2
3623,le jardin est long et étroit il y a une balançoire au fond et un barbecue proche de la terrasse sur laquelle est posée un transat,B1
3624,le bus est certes très pratique mais très dépendant de la qualité du trafic,B2
3625,notre charrette avait franchi le sommet dun autre monticule  en face de nous sétalait limmense étendue de la lande semée de rocs et de rochers,C1
3626,jajoute que vous êtes aussi fondatrice dune association  inversons la classe,C2
3627,il faut bien faire attention à ses vêtements et à sa coiffure,A2
3628,ne trouvestu pas que ces vieux murs noircis symboles maintenant et autrefois moyens du despotisme sont une véritable image du triste hiver ,C1
3629,parallèlement à lurbanisation et à la déchristianisation de la société française le septième jour libéré de ces contraintes est entré dans lère du temps libre,C2
3630,je suis vraiment content que tu aies pu venir,A2
3631,lordre de grandeur pour le moment par exemple pour lafrique est environ 350 milliards deuros de dette à légard de ses créanciers,B2
3632,il sest également arrêté dans une boulangerie où il a longuement hésité entre un pain au chocolat un croissant et une brioche aux pralines pâtisserie typiquement lyonnaise,B2
3633,cest une excellente idée ,B1
3634,ellénore gardait le silence,B2
3635,il interroge surtout la prétendue affinité élective de celleci avec le seul monothéisme,C1
3636,je me suis creusé la tête sans relache durant des heures pour résoudre ce cassetête chinois,C1
3637,dans le désert tous les hommes nont pas la peau noire,B1
3638,a cette occasion les enfants offrent des cadeaux à leur mère mais aussi de jolis oeillets,B1
3639,à partir de récits de vie elles dissèquent les motivations des candidats à la reconversion professionnelle,C1
3640,jai mangé un hamburger et des frites,A1
3641,ce petit nombre est notamment dû à ses expérimentations constantes et parfois désastreuses de nouvelles techniques,C1
3642,jai ensuite beaucoup pratiqué grâce à mon addiction à internet,C2
3643,je passai quelques heures à ses pieds me proclamant le plus heureux des hommes lui prodiguant mille assurances de tendresse de dévouement et de respect éternel,C2
3644,il est alors témoin dun spectacle étonnant,A2
3645,les enfants grands sont maudits par les dieux cest le vieux zahor qui la dit,B1
3646,estce quil y a des devoirs,A1
3647,questce que vous faites le samedi et le dimanche ,A1
3648,globalement presque une personne sur cinq 18 9 vit dans un ménage avec au moins un type darriéré de paiement et 10 0 avec au moins deux types darriérés de paiement le pourcentage de la population avec un ou deux types darriérés de paiement dimunant avec lâge le niveau de formation et les revenus,C1
3649,ils avaient auparavant reçu une lettre dune veuve qui après avoir consacré sa vie à élever seule ses enfants ne recevait leurs visites quen de très rares occasions,B2
3650,je fais mon lit tous les jours bien sûr et je fais souvent la vaisselle,A2
3651,il ny a presque pas de pollution,B1
3652,sécriaitelle en saisissant les mains de fabrice,B2
3653,serveur  une table pour quatre nestce pas ,A2
3654,pour éviter un oubli vous pouvez consulter le guide des formalités en ligne,B2
3655,un jour quil était venu nous voir à paris après dîner en sexcusant dêtre en habit françoise ayant après son départ dit tenir du cocher quil avait dîné chez une princesse  oui chez une princesse du demimonde  avait répondu ma tante en haussant les épaules sans lever les yeux de sur son tricot avec une ironie sereine,C2
3656,sil fait beau laprèsmidi vous pouvez aller au jardin du luxembourg et le soir vous pouvez faire un tour en bateau jusquà la tour eiffel,A1
3657,elle a beaucoup de mal à avancer dans la neige,A2
3658,le récit sordonne par laccumulation de saynètes procédé qui donne une tonalité picaresque au parcours mais qui participe aussi à ancrer les souvenirs dune mobilité dans des lieux ne seraientils que de passage,C2
3659,au village il y a les pour et les contre,B1
3660,lemployeur a en effet déjà obligation de prendre en charge la moitié de labonnement aux transports en commun de ses salariés,B2
3661,elle a 84 ans et elle habite à antibes,A1
3662,les femmes sont sousreprésentées dans le domaine des sciences,B2
3663,bonjour je vous appelle au sujet de mon imprimante photo,A1
3664, à ses proches,A2
3665,il ne change pas facilement davis il est têtu,B1
3666,le rythme dextinction des langues a ainsi atteint des proportions sans précédent dans lhistoire  10 par an à léchelle mondiale,C1
3667,plusieurs études ont démontré que lécobilan des modules photovoltaïques énergie grise émission du gaz à effet de serre est relativement positif comparé à dautres filières de production dénergie,C2
3668,ce dépassement rétroactif de la renaissance européenne a pour conséquence labandon du modèle évolutionniste linéaire tel que leurope des lumières puis le positivisme du xixe siècle lavaient formalisé,C2
3669,clara a bu de leau son frère a bu un verre de vin,A1
3670,il y a une ruée vers  devenons un peu plus indépendants moins dépendants des magasins de limportation des grandes surfaces donc une espèce de retour au savoirfaire artisan un peu de nos ancêtres de nos parents de nos grandsparents,B2
3671,il sagit dun projet pour la paix de notre temps,B1
3672,tout comme les comportements des animaux sont déterminés par linstinct leur environnement ou des déterminations biologiques les actes et les pensées des hommes le sont euxmêmes par de multiples facteurs à la fois internes et externes dont on ignore le plus souvent lexistence et la puissance  facteurs dorigine physiologiques psychologiques sociales etc,C2
3673,voilà le chemin à suivre finissonsen avec ce décalage inacceptable entre la cuisine den haut consommée par une minorité et la cuisine den bas celle de la majorité silencieuse débordante et insipide,C1
3674,sils vont au cinéma pour lavantpremière ils verront le dernier film de ce réalisateur de notoriété internationale,B2
3675,vous pouvez expliquer encore une fois sil vous plaît ,A1
3676,il y a eu trois expéditions,B1
3677,les inuits attendent seulement delle une déclaration politique,C1
3678,on pensait autrefois que si les régimes alimentaires étaient suffisamment énergétiques les micronutriments suivraient explique ainsi barbara burlingame fonctionnaire principale de la fao,C1
3679,considéré dès sa naissance comme un fils à part entière par son père il ne fut cependant jamais légitimé,C2
3680,nous sommes en 1915 à vitebsk la ville natale de marc chagall,B2
3681,un présage connu rapporte quun milan venu du ciel aurait fait un vol stationnaire audessus de son berceau la queue de loiseau le touchant au visage,C2
3682,cet héritage sest dailleurs vite révélé hétérogène  les pays pauvres dasie orientale les plus éloignés des anciennes métropoles émergent à des degrés divers dans léconomie mondiale dès les années 19701980,C2
3683,trop se spécialiser dans un environnement qui change sans cesse cest comme rouler vite avec des oeillères,C2
3684,merci madame biologiste vous avez fondé le site lassociation inversons la classe,C1
3685,je crois quen cinquante ans damitié on ne sest pas disputées une fois on a eu des petits mots de temps en temps mais jamais on sest fait la tête jamais on nest restées sans se parler jamais jamais jamais,A1
3686,plusieurs milliers de classes ont participé à ce projet,C2
3687,bref première leçon le québécois nest pas un français déformé mais plutôt un français historique proche de celui qui était parlé en france avant le 17e siècle,C1
3688,lextrémité supérieure de la corde est attachée à une planchette doublée de liège et une branche de coudrier très flexible fichée sur cette planchette soutient une petite sonnette qui tinte lorsque le poisson pris à la ligne donne des secousses à la corde,C1
3689,et cétait pas forcément une image qui me plaisait comme javais loccasion de pouvoir les changer jai voulu le faire,B1
3690,une semaine au calme ça procure un vrai plaisir,B1
3691,il faut aussi poser des questions sur le travail et les horaires de lentreprise,A2
3692,je recherche une personne pour garder mes enfants de 1 et 7 ans,A1
3693,je vais prendre ma douche dans ma salledebain,A1
3694,êtesvous prêts à découvrir cette histoire de noël ,A2
3695,il passa contre nous ne sinterrompit pas de parler à sa voisine et nous fit du coin de son oeil bleu un petit signe en quelque sorte intérieur aux paupières et qui nintéressant pas les muscles de son visage put passer parfaitement inaperçu de son interlocutrice  mais cherchant à compenser par lintensité du sentiment le champ un peu étroit où il en circonscrivait lexpression dans ce coin dazur qui nous était affecté il fit pétiller tout lentrain de la bonne grâce qui dépassa lenjouement frisa la malice  il subtilisa les finesses de lamabilité jusquaux clignements de la connivence aux demimots aux sousentendus aux mystères de la complicité  et finalement exalta les assurances damitié jusquaux protestations de tendresse jusquà la déclaration damour illuminant alors pour nous seuls dune langueur secrète et invisible à la châtelaine une prunelle énamourée dans un visage de glace,C2
3696,il ne reste donc plus quà attendre,A2
3697,lobjectif est de résuire les risques sanitaires et de diminuer les nuisances sur lespace public,B2
3698,la plateforme mettra à disposition lensemble de son catalogue musical et dit vouloir collaborer avec des acteurs locaux pour pouvoir élargir son offre de musique issue du marché concerné,B2
3699,nicolas va se marier pour la deuxième fois,A1
3700,également noble de visage et de corps dans laction comme au repos plein de grâce et de puissance mesurée il gardait au milieu de leffort le souci inconscient des pures attitudes et les moindres de ses gestes paraissaient des bienfaits,B2
3701,le beau monsieur qui était magicien le força alors à le conduire à la montagne et à ouvrir le rocher en le touchant avec lherbe merveilleuse,B1
3702,son grand chapeau à lespagnole tomba dans un geste quil fit  et aussitôt les instruments et les chanteurs entonnèrent le sextuor,C2
3703,du fond de la ténèbre verte toute criblée de gouttes de lumière une petite forme humaine pelotonnée dans son élan déboula comme un lièvre,C2
3704,forestier riait beaucoup de laventure  les deux femmes déclaraient que le bavard indiscret nétait quun goujat et quun lâche,C2
3705,il travaille en ville,A1
3706,en juillet ma famille et moi irons dans le sud de la france,B1
3707,je vais revenir avec les enfants la semaine prochaine,A1
3708,la recomposition conjugale après 50 ans est en forte progression précise vincent caradec professeur de sociologie à luniversité de lille iii vieillir après la retraite puf,C1
3709,ils sont trop mignons mon préféré est noir et blanc et il sappelle,A2
3710,cette situation est dautant plus préoccupante que la part de création de valeur des entreprises issue de la valorisation de ces actifs intellectuels est jugée par certains comme dépassant actuellement celle générée par les actifs matériels,C2
3711,à gauche cest ma salle de bain avec vue sur mon jardin,A2
3712,et après on peut prendre un bain dans la piscine leau est bonne ,A1
3713,or une forte exposition médiatique dun événement sportif qui plus est lorsquelle est associée à de bonnes performances de la part des sportifs en particulier français est susceptible de générer un engouement pour la pratique sportive explique linsee,C1
3714,pardelà ces collines dont le faîte offre des ermitages quon voudrait tous habiter loeil étonné aperçoit les pics des alpes toujours couverts de neige et leur austérité sévère lui rappelle des malheurs de la vie ce quil en faut pour accroître la volupté présente,C1
3715,en gros je nai rien contre les uniformes,B1
3716,ma maison est grande,A1
3717,je vous coupe les cheveux,A1
3718,lhomme avait lintention de sortir sa femme du trou,B1
3719,un technicien fait le nécessaire et vous rappelle dans une heure environ,A1
3720,elle avait besoin de passer un instant seule,A2
