id,sentence,difficulty
0,les coûts kilométriques réels peuvent diverger sensiblement des valeurs moyennes en fonction du moyen de transport utilisé du taux doccupation ou du taux de remplissage de linfrastructure utilisée de la topographie des lignes du flux de trafic etc,C1
1,le bleu cest ma couleur préférée mais je naime pas le vert,A1
2,le test de niveau en français est sur le site internet de lécole,A1
3,estce que ton mari est aussi de boston,A1
4,dans les écoles de commerce dans les couloirs de places financières il arrive aujourdhui de croiser de jeunes adultes de 20 ou 25 ans qui prévoient douvrir une maison dhôtes dans une quinzaine dannées,B1
5,voilà une autre histoire que jai beaucoup aimée,A2
6,les médecins disent souvent quon doit boire un verre de vin rouge après les repas,A2
7,il est particulièrement observé chez les personnes ayant un besoin de popularité développé qui considèrent dès lors le moindre signal du smartphone comme un possible indicateur de leur degré de popularité,B2
8,jai retrouvé le plaisir de manger un oeuf à la coque,A2
9,nous allons bien nous habitons dans une petite maison ancienne avec un très beau jardin,B1
10,bonjour et bonne année,A1
11,la presse sest abondamment fait lécho des effets secondaires ressentis par les soignants de moins de 65 ans,B2
12,pour que le rocher souvre il faut le toucher avec un brin dherbe,B1
13,jhabite une belle ville dans le nord de la france,A1
14,certes il doit répondre aux goûts du consommateur mais aussi aux capacités de son portemonnaie,B2
15,ma timidité me quittait dès que je méloignais dellénore  je reprenais alors mes plans habiles et mes profondes combinaisons  mais à peine me retrouvaisje auprès delle que je me sentais de nouveau tremblant et troublé,C2
16,je pense que fréquenter les galeries est la meilleure manière déduquer son oeil à lart contemporain,B2
17,le soir je me cuche tôt parce que je dois être toujours en bonne forme,A1
18,la mère de raphaël et de vanessa exprime sa satisfaction  depuis que ses enfants possèdent un portable ça a libéré ma ligne déclaretelle,B2
19,je ne fais pas grandchose à la maison,A2
20,elle ajoute quune interdiction totale est impossible à gérer,B2
21,sans plus dhésitation il tourna vers la gauche  son pas sonnait sur la terre durcie et ce bruit cadencé monotone assoupissait en le berçant le tumulte de son esprit,C2
22,comme le signale lexpression lingua franca le français a été pendant très longtemps la langue internationale eu égard à notre rayonnement politique aussi bien que culturel,C2
23,je ne tai pas téléphoné parce que jai eu trop de travail,B1
24,cest peutêtre ça que vous cherchez ,A2
25,questce qui peut bien poser problème dans ces petits livrets pourtant plutôt attractifs pour que seuls 23 4  de leurs détenteurs arrivent au bout ,C2
26,je consulte dhabitude ma messagerie et puis je prends un café,A1
27,nous sommes en train de dîner,A2
28,en fait je trouve que léducation est une bonne chose,B1
29,astu besoin de quelque chose,A1
30,perpétuel clandestin cest muni dun faux titre de séjour photocopie de la carte de résident dun copaincomplice quil avait ensuite sillonné lhexagone au bon vouloir demployeurs peu scrupuleux,C1
31,le mariage mixte apparaît comme le lieu privilégié ou les cultures saffrontent dialoguent et se fondent,B2
32,assis en terrasse dans le quartier touristique du vieux lyon james sirote une limonade bien fraîche,B2
33,la chronologie antique ne prend sens que sur un large pourtour de la méditerranée de même que ce découpage spatial nest pertinent comme entité géographique que durant cette période pendant laquelle la mer intérieure nest pas vécue comme une limite,C2
34,en voici un des moins obscurs  plus nous devenons maîtres de la biosphère plus nous en devenons dépendants  plus nous la dégradons plus nous dégradons nos vies5,C2
35,cest le début de troubles qui se poursuivent et sétendent au reste du territoire tout au long du mois de septembre les fameuses journées de septembre amplifiés le refus de guillaume 1er de considérer les revendications des insurgés,B2
36,les filles sétaient fait des colliers en fruits rouges qui ressemblaient à des perles,B2
37,je reste avec toi,A1
38,un revenu devient donc une nécessité pour que lhomme puisse accéder à la satisfaction davoir comblé ses désirs,C2
39,tu mangeas les petits fruits dès que tu les eus cueillis,C2
40,ben on est tous débordés quoi,A1
41,un petit garçon  ben trois dans un nid et dans lautre yen a deux,A2
42,jai été en forme toute la matinée,A2
43,lordinateur peut aussi répondre à des interruptions qui lui permettent dexécuter des programmes de réponses spécifiques à chacune puis de reprendre lexécution séquentielle du programme interrompu,C2
44,il a plu et jai attendu lautobus,A2
45,dans dautres cas il sagit de limites relatives basées sur un taux de croissance démographique de référence valables là aussi uniquement hors centres ou pondérées en fonction du degré de centralité,C2
46,cest bien ,A1
47,en 2007 moins de 8 des déchets des entreprises ont fait lobjet dune collecte sélective,B2
48,les médecins des donneurs vous conseilleront volontiers dans un tel cas vous renseigneront par rapport aux dons de sang,C1
49,le plus inquiétant cest que la scandinavie avait déjà battu des records de chaleur pendant lété 2018,A2
50,jaime le ski,A1
51,malheureusement il semble désormais évident quil ny a pas de voie pour obtenir une confirmation a écrit neera tanden à joe biden en retirant sa candidature,B2
52,pourquoi loisillon se retrouvetil seul dans la forêt ,A1
53,elle est née quel jour ,A1
54,il existe effectivement des êtres humains qui possèdent une quantité de pouvoir importante et qui contraignent lhumanité à travailler en créant un cercle vicieux qui fait du travail une nécessité pour accéder à ses propres désirs,C2
55,une bouchée de  cette expression fait référence à la quantité dun aliment quon met dans la bouche en une fois,B1
56,si tu respectait les indications plus sérieusement tu trouverais plus facilement ton chemin à travers ces ruelles,B2
57,aussitôt que julie eut découvert la vérité elle fut furieuse,C2
58,pile au moment où on a le plus besoin de réconfort,A2
59,le train en son temps était également craint brigitte munier les robots suscitent lenthousiasme des occidentaux mais aussi leur angoisse au lieu de les concevoir comme de simples outils ou à la manière japonaise tels damicaux auxiliaires ils craignent des compétiteurs menaçant leur avenir,C1
60,je viens demménager dans ma nouvelle maison,A2
61,et cette année ça défile ,B1
62,compte tenu de cette configuration cette zone est peu adaptée à des mesures de terrain pour limiter la diffusion des campagnols terrestres  les axes routiers ne représentant pas une barrière très forte pour cette espèce on peut aussi penser quun tel résultat est un artéfact dû à la coupure artificielle dune seule tache de prairie,C1
63,après mûre réflexion la commission européenne a eu une idée brillante sattaquer à un nouveau chantier qui avait jusquelà bizarrement échappé à sa sagacité légendaire,C1
64,avec de lexpérience le télévendeur peut devenir animateur dun pôle de télévendeurs superviseur déquipe chef de plateau,B1
65,et toi questce que tu vas faire ,A2
66,les valorisations boursières des sociétés internet comme amazon,C2
67,sur dautres on entendait une série de détonations tandis que des contestataires scandaient notre révolte doit réussir,C1
68,les babyboomers en sont convaincus tout peut recommencer à 50 ans,C1
69,rien nétait si beau si leste si brillant si bien ordonné que les deux armées,B1
70,comment tappellestu ,A1
71,largué par la sonde européenne rosetta le petit robot avait atterri mercredi en fin daprèsmidi sur le noyau de la comète tchourioumovguérassimenko une première de lhistoire spatiale,B2
72,elle pendit son linge au dossier dune chaise elle demeura debout tournant examinant les meubles frappée dune telle stupeur que ses larmes ne coulaient plus  il lui restait un sou sur les quatre sous gardés pour le lavoir puis entendant rire à la fenêtre étienne et claude déjà consolés elle sapprocha prit leurs têtes sous ses bras soublia un instant devant cette chaussée grise où elle avait vu le matin séveiller le peuple ouvrier le travail géant de paris  à cette heure le pavé échauffé par les besognes du jour allumait une réverbération ardente audessus de la ville derrière le mur de loctroi  cétait sur ce pavé dans cet air de fournaise quon la jetait toute seule avec les petits et elle enfila dun regard les boulevards extérieurs à droite à gauche sarrêtant aux deux bouts prise dune épouvante sourde comme si sa vie désormais allait tenir là entre un abattoir et un hôpital,C2
73,le sérum qui a pâti de la comparaison avec ses concurrents pfizer et moderna est désormais considéré comme aussi efficace pour prévenir le risque dhospitalisation,C1
74,jai identifié trois peurs fondamentales du robot la crainte instinctive du métal contre la chair la crainte sociétale presque désespérée du robot qui va voler le travail de lhomme et enfin la crainte identitaire de voir le robot nous dépasser en capacités intellectuelles ou autres,C2
75,mais dautres pourront préférer lassassin des échecs ou les annales du kangourou editions du kangourou ,C2
76,vous ferez de la randonnée ,B1
77,il y a plus de 50 pays francophones ,A1
78,ils ont déjà lobligation de les ramener chez eux,B1
79,un autre  oui on leur a bien donné des noms,A2
80,vous joindrez à votre formulaire les pièces justificatives et documents sous format numérique,B2
81,merci bon voyage,A1
82,ce geste presque insensible lui fit courir de la tête aux pieds un grand frisson sur la peau et se tournant vivement il se jeta sur elle cherchant la bouche avec ses lèvres et la chair nue avec ses mains,C2
83,il clabaude aux esgourdes des blaireaux enfarinés et des tordus pasteurisés,C2
84,avec sa nouvelle compagne de quatorze ans sa cadette il dit vivre une renaissance,C1
85,entre ceux qui ne jurent que par lintroduction de linformatique dans lenseignement obligatoire et ceux qui ont peur que lon veuille transformer le primaire en une grande école dinformatique il existe pourtant des pistes pour initier les enseignants et favoriser un passage du périscolaire au scolaire sans avoir à attendre une réforme du socle commun qui prendra des années,C2
86,parmi les acteurs du commerce équitable il faut distinguer les organismes labellisateurs qui certifient des filières dimportation par produit et les importateurs  grossistes détaillants ou réseaux de boutiques comme artisans du monde  qui ont leurs propres contacts avec les producteurs et sautocontrôlent faute de mieux,C1
87,elle peut donc ouvrir dautres réflexions et finalement devenir très enrichissante,B2
88,ce paysan pleurait et prétendait quon lui avait tout pris  fabrice lui donna un écu et il trouva de lavoine,B2
89,la première limite est que les instruments de contingentement spatial pris en compte donnent une idée de la maîtrise potentielle de lurbanisation maîtrise dérivant des possibilités fournies par le cadre légal et stratégique dont chaque canton sest doté,C2
90,le petit chat a plu à mes parents,A2
91,se prémunir contre laltération des données et avoir la certitude quelles nont pas été modifiées lors de leur stockage ou de leur traitement contribue à la qualité des prises de décisions basées sur cellesci,C2
92, nous sommes des joueursjoués3,B2
93,quand jai lu jai découvert de nouvelles choses surprenantes sur les locataires qui occupaient lappartement,B1
94,vous avez dit la seule chose intelligente ,A2
95,mon ami ne répond pas au téléphone,A1
96,mon frere patrice est plus jeune que moi,A2
97,ils sont en vacances il ny a que nous sur cette partie de lîle,B1
98,quand il y a des nuages avec de la neige qui tombe cest quil va neiger et quil peut y avoir du brouillard des risques de congélation de la glace et que la température sera très basse,B1
99,un escalier nous conduisit à une large coursive en hauteur qui faisait le tour du bâtiment desservant une succession de bureaux,C2
100,que vous cherchiez une simple annonce ou un recruteur vous êtes sûr de ne rater aucune offre demploi grâce à notre système dalerte personnalisé,B2
101,ça nous a donc coûté de largent sénervetelle,B1
102,vous vous appelez comment ,A1
103,fabrice à peine âgé de seize ans représentait fort bien le chef de la maison,B2
104,oui je suis à paris depuis vingt jours à peine,A1
105,lapprentissage du code et plus largement dune culture générale du numérique à lécole est une mesure réclamée depuis longtemps par lacadémie des sciences soutenue par des acteurs qui comptent dans le secteur numérique comme la cnil ou le conseil national du numérique et qui figure même dans une proposition de loi de la députée ump laure de la raudière,C2
106,pourquoi ne pas avoir donné la serviette alors que tu avais déjà les plans ,B1
107,quand je rentre je demande à mes parents si je peux tappeler pour avoir de tes nouvelles,A2
108,limportant évidemment pour les contribuables européens qui voudraient annuler leur dette cest que chacun des créditeurs des créanciers soit traité de la même façon,B2
109,même lambassadeur birman aux nations unies kyaw moe tun a rompu de manière spectaculaire avec les généraux putschistes la semaine dernière en appelant à mettre fin au coup detat,C1
110,le directeur aurait donné de nouvelles consignes au personnel,B2
111,vos regards mobservent,C2
112,de nombreux auteurs ont spéculé sur les différents aspects de la personnalité de léonard,C1
113,les conséquences sur la nature sont gravissimes notamment sur les océans qui contiendraient selon la revue américaine science plus de 110 millions de tonnes de déchets plastiques,B2
114,si sept millions de citadins rêvent de refaire leur vie aux champs tous ne passent pourtant pas à lacte il y a toujours un événement déclencheur constate la directrice de changer tout,B2
115,mon père bien quil observât strictement les convenances extérieures se permettait assez fréquemment des propos légers sur les liaisons damour  il les regardait comme des amusements sinon permis du moins excusables et considérait le mariage seul sous un rapport sérieux,C2
116,après tout que lui offretelle à part de lennui et une grosse boule dangoisse au creux du ventre ,A2
117,leur pavillon mitoyen à paris était pratiquement neuf quand ils lavaient acheté,B2
118,lémigration galicienne soustend lévolution du peuplement et lexplique en grande partie,C1
119,ces tanières se fondent dans la nature pour être quasiment invisibles,C1
120,les hommes se croient libres alors quils sont contraints ou déterminés par leur nature,C2
121,il fallait radicalement changer de cap en choisissant la cuisine de qualité accessible au plus grand nombre au lieu de quoi nous nous sommes repliés sur des valeurs sûres désormais désuètes et indigestes,B2
122,nos prophéties disent que tant quil y aura des bisons sauvages nous survivrons,C1
123,je mappelle camille et quand jetais enfant javais des reves plein la tete,A2
124,réaffirmant que le sénat ne sétait livré à aucun chantage contrairement aux allégations du rapporteur pour lassemblée nationale il a au contraire affirmé que la position de la haute assemblée relevait dune conception cohérente et constante de la société,C1
125,quelques coups de battoir partaient encore espacés au milieu des rires adoucis des conversations qui sempâtaient dans un bruit glouton de mâchoires  tandis que la machine à vapeur allant son train sans repos ni trêve semblait hausser la voix vibrante ronflante emplissant limmense salle mais pas une des femmes ne lentendait  cétait comme la respiration même du lavoir une haleine ardente amassant sous les poutres du plafond léternelle buée qui flottait la chaleur devenait intolérable  des rais de soleil entraient à gauche par les hautes fenêtres allumant les vapeurs fumantes de nappes opalisées dun gris rose et dun gris bleu très tendre  et comme des plaintes sélevaient le garçon charles allait dune fenêtre à lautre tirait des stores de grosse toile  ensuite il passa de lautre côté du côté de lombre et ouvrit des vasistas,C2
126,que du bonheur ,A2
127,on semble oublier que le personnel en milieu scolaire applique déjà cette mesure,B2
128,une association de promotion et de développement de lapprentissage en ligne note que si la calculatrice a supplanté le calcul mental y compris pour des opérations basiques et que lutilisation dun ordinateur relié à internet pourrait aisément remplacer une partie de notre mémoire les opérations basiques ont ont été mémorisées en amont et cest grâce à cette assimilation de connaissances basiques que lapprenant peut utiliser la calculatrice,C1
129,tous sauf un petit oiseau,A1
130,sa santé sest dégradée à cause dune infection sévère et ses jours sont comptés,B2
131,la chose me vient dêtre certifiée,B1
132,la nouvelle a fait grand bruit cette affaire de couvrefeu cache en fait une angoisse plus profonde,B1
133,jai le plaisir de vous annoncer que votre demande dinscription à luniversité de strasbourg en première année de master sciences et société a été acceptée,B1
134,une large majorité de français est favorable à la modification du calcul de la retraite des fonctionnaires dans le cadre de la réforme en préparation selon un sondage publié vendredi,C2
135,aussi les jeunes heureux réussissent à acheter leur autonomie et leur tranquillité par une réussite au lycée qui ne les dévore pas,B2
136,une fois quil a tout fini theo peut enfin aller jouer et samuser avant de diner avec ses parents,A2
137,la cinquantaine est un bel âge on gagne en profondeur et en bienveillance constate philippe wattier,C1
138,les quelques chiffres publiés à ce jour donnent une idée de la dégradation du climat entre les élèves des deux sexes,C1
139,mais une différence apparaît en fin de cursus scolaire les garçons prenant dans ce dernier domaine un avantage sur les filles,B2
140,le vert par exemple est la couleur de lherbe et des feuilles des arbres,A1
141,elle ne ressemble à aucune des filles que je connais,A2
142,les masses liquides transportent les plus grandes espèces connues de mammifères et peutêtre recèlentelles des mollusques dune incomparable taille des crustacés effrayants à contempler tels que seraient des homards de cent mètres ou des crabes pesant deux cents tonnes ,B2
143,force est de constater que lécart se creuse entre les pays en développement qui progressivement sortent de la pénurie chronique et ceux qui stagnent ou régressent dans leur combat contre la faim,C1
144,une huitième édition dominée par le duel au sommet avec alex thomson une course poursuite menée par armel depuis le 23 novembre dernier quarantesept jours de haute tension qui se terminent aujourdhui,C1
145,pourquoi on ne peut pas entrer dans la chambre ,A1
146,à très bientôt,A2
147,cétait cette comparaison tacitement et inlassablement répétée dans une même toile qui y introduisait cette puissante et multiforme unité cause parfois non clairement aperçue par eux de lenthousiasme quexcitait chez certains amateurs la peinture delstir,C2
148,soyons sérieux,B2
149,bienheureux le quidam que voilà débarrassé de cette peur originelle déchouer et de faire faux,C2
150,je prends le train,A1
151,cest dans sa lettre à schuller extraite de sa correspondance que spinoza dénonce lillusion du libre arbitre,C2
152,je prends mon petitdéjeuner dans la cuisine,A1
153,il nous arrive de procéder de cette façon de temps en temps,A2
154,alors quau cours du paléolithique la diffusion avait fractionné lécoumène en petits groupes la tendance depuis la fin de la dernière glaciation est à lépaississement des relations dans lancien monde par augmentation des effectifs et par tissage dinterconnexions,C2
155,or la croissance démographique concerne surtout les pays en voie de développement qui connaissent aujourdhui des problèmes de sousalimentation et de mauvaise alimentation,C1
156,je suis dans ma chambre,A1
157,une indéniable sérénité se reflétait sur ses traits,C2
158,le jour de lan correspond au 1 janvier,A1
159,étant féru dart yves saint laurent a constitué au fil des années une importante collection dobjets précieux et de peintures qui ont inspiré certaines de ses créations,C1
160,ils suivaient une sente creuse que dominait des deux côtés un talus de six pieds de haut,C2
161,je ne comprends pas,A1
162,mais à partir de ce moment elle nécouta plus  et le choeur des conviés la scène dashton et de son valet le grand duo en ré majeur tout passa pour elle dans léloignement comme si les instruments fussent devenus moins sonores et les personnages plus reculés  elle se rappelait les parties de cartes chez le pharmacien et la promenade chez la nourrice les lectures sous la tonnelle les têteàtête au coin du feu tout ce pauvre amour si calme et si long si discret si tendre et quelle avait oublié cependant,C2
163,et nos esprits qui reçoivent les instructions de ces organes diversement impressionnés comprennent analysent et jugent comme si chacun de nous appartenait à une autre race,C1
164,trop concrète peutêtre après le temps du rêve aucun terminus ne semble pour lécrivain pouvoir justifier davoir enduré tant de souffrances ni inciter à rompre avec le temps du vagabondage,C2
165,nous explorons la meilleure voie légale probablement via le système interaméricain en invoquant la déclaration des droits de lhomme de 1948,C1
166,à ce comptelà les cours de langue au collège pourraient être profitablement remplacés par des séances de mémorisation de lannuaire,C2
167,je préfère un autre bijou,A1
168,il na pas de veste,A1
169,un autre inconvénient à cette interdiction est le risque de priver les adolescents dun apprentissage sur lutilisation raisonnée dinternet et des réseaux sociaux,B2
170,le massacre est commémoré sur le drapeau de la ville de chicago par sa première étoile rouge,B1
171,je ne trouve pas la rue du marché,A1
172,fruit dune pensée élaborée depuis la renaissance lindividualisme est un projet de société dans lequel chacun devrait trouver les meilleures conditions de sa réalisation et de son épanouissement,C1
173,cette année ce nest pas moins de 12 millions délèves qui ont repris le chemin de lécole,A2
174,sébastien granet et hélène lavoie la cheffe nous ont accueillis malgré un autobus de visiteurs qui ripaillaient,C2
175,les parents qui ont du mal à couper le cordon sétonnent que leurs enfants préfèrent brancher leur boîte vocale et ne répondent pas à leurs appels,B2
176,cest pourquoi nous demandons aujourdhui que le président de la république tienne sa parole et soumette sans filtre les propositions de la convention au référendum au parlement ou à application réglementaire directe,C1
177,je ne trouve pas mes clés de maison,A1
178,les industriels polluent leau lair et les sols avec leurs produits toxiques,B2
179,il met son plus beau costume et son chapeau,B1
180,dabord la dernière élection présidentielle où le vote pour le front national fut autant le fait des jeunes électeurs que de leurs aînés,B2
181,selon un sondage publié en mai dernier par bva société française de sondages et le syntec numérique fédération professionnelle du secteur informatique favorable à la mesure 87  des français seraient même daccord pour que la programmation informatique soient enseignée à lécole 24  à partir du primaire 41  à partir du collège,C2
182,les parents de banlieue se sont organisés pour les devoirs des enfants,A2
183,vous attendîtes la surprise que vos parents vous eurent promise,C2
184,le duo na pas grand chose en commun mis à part ses positions relativement conservatrices qui lui vaut les foudres des progressistes,B2
185,or sur les quelque 6 000 langues qui existent actuellement dans le monde la moitié compte moins de 10 000 locuteurs et un quart moins de 1 000,C1
186,les passants semblent moins pressés et sattardent plus facilement devant une devanture ou dansles rayons,B2
187,a qui appartient le chien qui aboie nuit et jour ,B1
188,elle sait parler anglais et espagnol,A1
189,ce phénomène cest lapparition dune génération inédite,B2
190,après lambiance de luxe ici cest comme un tranquille village,B1
191,des chiffres tirés dune des rares enquêtes sur le sujet réalisée en 2000 publiée en 2001 par linstitut de recherche sur léconomie de léducation auprès des parents de 2 500 enfants de lacadémie,C2
192,monet peignit ce portrait emplit de sensualité et lourd de symbolisme,C1
193,elle pense à lui,A1
194,oui louragan a touché terre la nuit dernière dans le nord du nicaragua il sest ensuite étendu à plusieurs pays damérique centrale,B1
195,je viens demmenager dans ma nouvelle maison,A2
196,de toute façon chacun sait que pour choisir son logement idéal cela peut prendre plusieurs mois,B1
197,parmi les habitants de la région il y a ceux qui veulent revenir et ceux qui ne veulent pas,A2
198,nous apportons des arguments experimentaux et théoriques en faveur dun mecanisme intramoleculaire,C2
199,on choisit la date le lieu et le projet qui nous intéressent on paye et on part ,B1
200,dans les campagnes cest différent ,A2
201,faites des groupes de trois personnes,A1
202,la salle craquait sous les bravos  on recommença la strette entière  les amoureux parlaient des fleurs de leur tombe de serments dexil de fatalité despérances et quand ils poussèrent ladieu final emma jeta un cri aigu qui se confondit avec la vibration des derniers accords,C2
