id,sentence,difficulty
1098,que le vulgaire croie à des comètes extraordinaires qui traversent lespace ou à lexistence de monstres antédiluviens qui peuplent lintérieur du globe passe encore mais ni lastronome ni le géologue nadmettent de telles chimères,C2
1099,vous avez fait de lexercice physique,A2
1100,tour dhorizon du bilan de ces douze jours de tractations,C1
1101,je suis dentiste dans un nouveau cabinet depuis une semaine et jaime mon travail,B1
1102,par conséquent daprès marx les hommes qui détiennent les clés des désirs de lhumanité auront en leur possession un pouvoir immense et une responsabilité dautant plus importante,C2
1103,tapez votre message sur les touches de votre téléphone,A1
1104,jaimerais bien être figurant dans un film mais je nai pas encore eu loccasion de lêtre,B1
1105,il prefere quand les sommes ne sont pas arrondies,A2
1106,quand les joueurs eurent terminé le match ils prirent une boisson énergisante,B2
1107,une abeille ma piqué cest très douloureux,B1
1108,comment est votre blanquette ,A2
1109,quelles sontles démarches à faire pour obtenir ce documment,B2
1110,cest au premier temps de la colonisation du continent américain par les colons européens au xviie siècle quil faut remonter pour comprendre cette fête si particulière,B2
1111,rien ne vaut un bon livre ,A2
1112,malgré leur situation privilégié ces chatons connurent déjà la misère la famine et le froid extrême,C1
1113,jai un frère et une soeur,A1
1114,il déplaçait les chaises en faisait des obstacles la forçait à pivoter pendant une minute autour de la même puis quittant cellelà en saisissait une autre,C2
1115,au début lhomme est un être naturel comme les animaux or il est aussi naturellement démuni face aux autres car le frère de prométhée epiméthée omet de le doter dune capacité qui lui permettrait de survivre,C2
1116,au sein du gouvernement français rares sont ceux qui peuvent afficher sur leur cv ne seraitce quune année à la fac,C2
1117,il élabore des méthodes pour défendre la ville dune attaque navale des turcs avec notamment linvention dun scaphandre à casque rudimentaire,C1
1118,je lis un livre très intéressant ,A1
1119,elle allait vers le sud où il faisait moins froid,A2
1120,elle est certainement devenue mauvaise à cause de son mari,B1
1121,cest un retour impatiemment guetté par les gamins des bourgades bretonnes,C1
1122,les pèlerins partagèrent alors cette célébration avec leurs voisins indiens et ceuxci apportèrent alors des dindes à rôtir,C1
1123,jhabite un quartier calme,A1
1124,létude des dépouilles avec laide darchéovétérinaires a permis de remarquer que la plupart des animaux enterrés à bérénice sont morts de maladie parfois jeunes ou de blessure,C1
1125,en effet sitôt rentrés chez eux vanessa 14 ans raphaël 16 ans marie 44 ans et patrick 45 ans branchent les petites boîtes colorées afin de les recharger,B2
1126,avant noel vous achetez des cadeaux pour tout le monde,A1
1127,plus grave un lien a été mis en évidence entre ces usages et des symptômes de dépression,B1
1128,pourfendeur des sciences et des arts fossoyeur de la propriété privée contempteur de la monarchie ce bonhomme qui égratigne au passage les médecins les femmes les gens de lettres et les anglais sent le fagot,C2
1129,jai décidé de peindre les murs en jaune et dy installer mon piano,A2
1130,un bureau ,A1
1131,chêne mon aile est cassée je ne peux pas voler,A2
1132,or il faut bien différencier une contrainte dune obligation qui elle est une activité que lindividu simpose luimême librement,C2
1133,elle porte des lunettes,A1
1134,au fond beaucoup franchissent avec vaillance le mur du son de la cinquantaine,C1
1135,je suis une passionnée de montagne,A1
1136,on ne peut pas utiliser son portable et il nest pas permis de manger,A1
1137,cest à dire ce nest pas une volonté hiérarchique qui viendrait des ministères ou de lacadémie ce sont les enseignants qui il suffit de regarder divers blogues sur internet denseignants qui se posent des questions au primaire secondaire collège lycée,C2
1138,ainsi il existe déjà une méthode pour passer du virtuel au réel,B1
1139,hier sest terminé le salon de la pâtisserie de paris,A2
1140,les enquêteurs sont convaincus que lécoute électronique des conversations téléphoniques est un outil essentiel à la police,B2
1141,bon résultat de léconomie française ce moisci plus quatre pour cent,C1
1142,il a rendezvous chez le médecin,A1
1143,souvent je marrêtais pour parler avec les villageois,A2
1144,le monastère avait donc conservé son église médiévale qui faisait également office de paroissiale,C1
1145,mais aussi des fraisiers  je me régale et je fais le plein de vitamines jespère que tu passes de bonnes vacances à limoges,A2
1146,curieusement lactuel président du groupe radiofrance ne se souvient pas du débat après larrivée de m aphatie  son arrivée na pas été critiquée car il était évident que jeanmichel aphatie avait beaucoup de présence à la radio,B1
1147,il ne peut en rester quun,A2
1148,dans le sac il y a un téléphone des clés un ordinateur une photo et un portefeuille,A1
1149,tous les dimanches je vais faire mes courses au marché,A1
1150,lécole atelle fait changer le monde ,A2
1151,le backtesting évalue essentiellement la performance dune stratégie de trading sur des données historiques si nous avons utilisé une stratégie donnée sur un ensemble dactifs dans le passé dans quelle mesure elle aurait été performante,C1
1152,depuis quelles se sont diversifiées au moins 30 000 sont nées et se sont éteintes souvent sans laisser de trace,C1
1153,je travaille chez moi le matin et laprèsmidi,A1
1154,avec de nombreux professionnels jai appelé en tant que contrôleuse générale des lieux de privation de liberté cgpl à une vaccination massive du personnel et des prisonniers,C1
1155,au regard des défis posés à la société multiculturelle le couple mixte se présente comme un laboratoire intensif de tous les instants déchanges danalyses de synthèses capable dimaginer des solutions originales applicables à un niveau individuel mais susceptibles dinspirer les politiques collectives ou dans certains cas dêtre transposées à léchelle de la société,C1
1156,nous ne nous attendions pas à un tel buzz,B1
1157,oh mais attends une seconde ,A2
1158,vous allâtes dans une contrée lointaine pour tout oublier de vos erreurs passées dont seul le commun des mortels ignore,C2
1159,la salle commençait à se remplir on tirait les lorgnettes de leurs étuis et les abonnés sapercevant de loin se faisaient des salutations,C2
1160,débuter la journée par un premier repas organisé autour dune de ces boissons dopantes que lon sucre preut sembler passablement anecdotique,C2
1161,le tas de riz tantant tanta le tas de rats tentés,C2
1162,a til parlé dastuces pratiques pour un bienêtre quotidien et dun questionnement philosophique sur cette quête de limpossible,B1
1163,accusé de manger à tous les râteliers lélu démissionne,B2
1164,lui qui enfant suivait sa mère trappeur peut encore aujourdhui emmener son fils de 14 ans chasser mais dit craindre la réduction des quotas de chasse pour les ours polaires,C1
1165,un enseignement fondé sur lexpérimentation et la pratique des objectifs dapprentissage transversaux des actions tournées en priorité vers la formation continue des enseignants menées en collaboration avec la communauté scientifique et professionnelle,C1
1166,alors quelle revenait du marché à travers la brousse une femme laisse tomber une cruche et continue son chemin sans sapercevoir de rien,A1
1167,le bébé pleure depuis des heures il a faim,A1
1168,les cadeaux seront déposés à son pied le soir du 24 ou le 25 décembre au matin,B2
1169,dans cette ville tout comme à paris et londres les autorités ont déjà décidé de mettre en place des règles pour limiter la durée de location,B1
1170,vec ses livreurs à vélo aux énormes sacs à dos carrés lentreprise est devenue incontournable pendant la pandémie,C1
1171,depuis combien de temps,A2
1172,idem pour les voies technologiques,C1
1173,il savait déjà quil faut éviter les aliments grossiers les lourdes venaisons et les boissons fermentées  il connaissait aussi linfluence bienfaisante des bains fréquents qui gardent la peau saine et reposent des fatigues,B2
1174,cest la jungle,A2
1175,spacex officiellement space exploration technologies corporation est une entreprise américaine spécialisée dans le domaine de lastronautique et du vol spatial,C1
1176,la merveilleuse paix de cet été endormi entrait en moi comme une marée,C2
1177,aujourdhui nous magnifions les robots pour faciliter leur future acceptation sociale relève le psychiatre serge tisseron de luniversité parisvii dans le magazine les dossiers de la recherche mais cette forte empathie peut avoir son revers,C2
1178,les dernières semaines avant noël se déroulent dans une ambiance joyeuse et féérique,B2
1179,or ces mêmes statistiques en témoignent on trouve,C1
1180,mais déjà le commerce équitable commence à être récupéré par des entrepreneurs au nez creux et peu soucieux de respecter les critères fondamentaux trop contraignants,C1
1181,cest les discussions daujourdhui,A2
1182,cette assurance me calma  je sentis ma douleur sapaiser,C2
1183,papa raconte une histoire aux enfants pour les endormir,A1
1184,mis en place par lécoorganisme récylum ce dispositif intéresse en premier lieu les entreprises du bâtiment mais aussi les industries et les collectivités territoriales qui détiennent du matériel alarmes incendie caméras de surveillance qui ne fonctionne plus,B2
1185,jen conclus que les réalistes de talent devraient sappeler plutôt des illusionnistes,C1
1186,vous ouvrîtes la boîte à musique et découvrîtes un bijou serti de pierres précieuses multicolors,C1
1187,si nous avions eu suffisament dargent nous aurions pris lavion pour nous rendre à notre conférence sur les enjeux écologiques du siècle et ainsi participer activement au débat,B2
1188,je ne veux pas,A1
1189,la journée est longue pour david qui attend le samedi toute la semaine,A2
1190,nous souhaitons favoriser davantage la création et louverture à dautres publics explique nathalie perringilbert,C1
1191,je me réjouis de te revoir pendant les vacances,A2
1192,de fait les relations de lindividu au groupe du privé au collectif demeurent complexes dans lhexagone,B2
1193,il était une fois une petite fille de village,A2
1194,laddition silvousplaît ,A1
1195,ils doivent également présenter le cas échéant les documents justifiant de lobjet et des conditions de leur séjour,C1
1196,un petit garçon  on essaye de leur parler,A2
1197,le couple a bien fait dévacuer,A2
1198,lorsquelle eut revu son premier amoureux son coeur battit follement,C2
1199,de fait en scindant son enseignement supérieur en deux systèmes concurrents la france a créé une hiérarchie dans toutes les têtes la grande école est synonyme de réussite luniversité de rebut,C2
1200,on le trouvera ridicule et ce sera une catastrophe,B1
1201,questce que vous avez comme tartes ,A1
1202,on partait de bonne heure pour ne pas être coincés dans les embouteillages,A2
1203,la fao organisation pour lalimentation et lagriculture estime que 95  des personnes victimes de sousalimentation chronique vivent dans les pays en voie de développement,C1
1204,on vient dacheter une résidence secondaire au pays basque qui sera notre point de ralliement familial,C1
1205,léchange cestàdire linteraction verbale se présente comme une coconstruction constitutive de la dynamique du groupe  cest en tenant compte des interlocuteurs et de la façon dont ils se positionnent les uns visàvis des autres selon les objets et les enjeux des interactions que lon envisage danalyser tant la variation des usages en présence que lhétérogénéité constitutive du dire dans cet espace,C2
1206,mon mari a enfin trouvé une place darchitecte et travaille sur un important projet dimmeuble avec son équipe,B1
1207,cest somptueux,A2
1208,bonne chance ,A1
1209,jouvrais la porte et le chien courait à lextérieur,A2
1210,mais quils prétendent être les seuls acteurs légitimes pour définir et normaliser le commerce équitable cest nier les autres pratiques et refuser le débat avec tous les acteurs de la société civile ce qui est inadmissible,C1
1211,non je ne parle pas français,A1
1212,il est tombé malade lannée précédant son mariage,B2
1213,les maires ont ainsi voulu montrer quils les avaient à loeil,B1
1214,il allait devoir passer lhiver ici dans la forêt en attendant dêtre guérit,B1
1215,il est très fâché parce quelle ne lui a pas répondu au téléphone,A1
1216,celuici ancien soldat devinant dabord le plan de campagne de son interlocuteur parla des protections quavait son maître ajoutant que certes on ne lui chiperait pas ses beaux chevaux,C1
1217,je ne te crois pas,A1
1218,le journal a été emporté par un coup de vent,B1
1219,les optimistes soulignent quil ne représente encore quune part infinitésimale des échanges internationaux mais que le concept est porteur,C1
1220,sans y penser jai fait des erreurs ,B1
1221,quand tu sors de lascenseur tourne à droite et encore à droite,A2
1222,et il regardait tous ces hommes attablés et buvant tous ces hommes qui pouvaient se désaltérer tant quil leur plaisait,B2
1223,elle a préparé les photocopies pour les participants à la réunion de laprèsmidi,B1
1224,ainsi madame qui est irlandaise et vit à lieu témoigne  en france si je parle anglais à mon fils il me répond plutôt en français,B1
1225,capacités intellectuelles ou problèmes dorientation ,B2
1226,a affronter ce monde et laméliorer,A2
1227,deux guerres mondiales en 1914 et 1939 convainquirent cependant de nombreux européens que le concert européen avait échoué et ne parvenait plus à gérer les affaires du continent,C2
1228,il y a des cours de portugais,A1
1229,les spécialistes de la violence chez les adolescents rappellent quil est dangereux de les considérer comme une armée menaçante,B1
1230,malheureusement il ne sagit que de moyenne,B1
1231,le paysage devient tout blanc à cause de la neige et de la glace,A1
1232,laprèsmidi jai encore beaucoup de choses à faire,A2
1233,de fait la nature peut être par lhomme changée tout à fait transformée ébranlée jusquen ses fondements et cest pourquoi il sied de réhabiliter le mot de magie en lui redonnant le sens honorable quil avait autrefois et en désignant par là une science justement ambitieuse qui de la connaissance des formes cachées déduit des opérations étonnantes,C2
1234,le bleu est très présent dans la nature  cest la couleur du ciel et de la mer,A1
1235,elle fais ses devoirs puis prépare le dîner et finalement elle regarde un film avant daller se coucher,A2
1236,pas de fête avec vous ce soir,A1
1237,je narrive plus à dormir depuis quelques jours à cause de mes voisins et leurs travaux,A2
1238,cétait une chétive créature une masse de chair ridée avec des paupières entrecloses des traits informes et à peine ébauchés,C2
1239,jaime les pommes de terre,A1
1240,elle a juste miaulé craintivement et sest recroquevillée sur sa branche oú elle se trouve,B2
1241,mesdames messieurs votre attention sil vous plaît,A2
1242,en cinquante ans les progrès accomplis par les techniques de linformation ont entraîné une amplification extraordinaire des flux dinformations,C1
1243,je regarde un film en allemand,A1
1244,les vacances sont les moments préférés de pierre car il a pour habitude daller chez ses grandsparents qui vivent dans une ferme de la campagne normande,A1
1245,figurezvous un turc allant la nuit chez paul niquet,B2
1246,la comtesse sétait passionnée pour le caractère primitif et pour lastrologie de labbé blanès,C1
1247,pour dissuader ses lyceens de faire les beauxarts lecole du cirque ou un diplome darts du spectacle un proviseur avait coutume de leur raconter cette histoire  javais deux copains,C1
1248,perrette retenant sa respiration tellement était forte lodeur nauséabonde dhuile de vidange dans la chambregarage,C1
1249,néanmoins lintroduction de la notion de genre dans la santé entraîne une meilleure compréhension des processus biologiques et sociaux intriqués qui influencent les trajectoires de santé des hommes et des femmes,C1
1250,pour conjurer les deux mois de vacances ils achetent donc leur potion en librairie pour un investissement moyen de 7 euros,C2
1251,le courant dair ainsi créé permet à la sueur  qui absorbe la chaleur du corps  de sévaporer et ainsi de le refroidir,B1
1252,la pelle les pincettes et le bec du soufflet tous de proportion colossale brillaient comme de lacier poli tandis que le long des murs sétendait une abondante batterie de cuisine où miroitait inégalement la flamme claire du foyer jointe aux premières lueurs du soleil arrivant par les carreaux,C2
1253,mais les chiens et les chats ne saiment pas beaucoup ,A1
1254,il soffre les meilleurs guides gravit les montagnes sepanouit,C1
1255,les préadolescents et adolescents semblent particulièrement sensibles,B2
1256,les cordes vocales ce sont des muscles hein et donc jai un entraînement quotidien parce quon doit être raccord avec des enregistrements qui ont quelquefois 10 voire 15 ans,B2
1257,elle trouvait ça drôle finissait par rire et sanimant commençait à trottiner derrière lui avec de légers cris joyeux et craintifs quand elle 143 avait cru le saisir,C2
1258,il est en train de ranger ses affaires,A2
1259,tout comme la révolution industrielle a vu naître le capitalisme je suis persuadé que la robolution va profondément modifier notre système économique,B2
1260,on a ainsi constaté chez les femmes urbaines de haut niveau socioéconomique au brésil 28  de réduction de la surcharge pondérale de 1989 à 1997,C1
1261,cette réponse me bouleversa,C2
1262,les dames rient je pense quil y aurait de la bagarre hein,A2
1263,tu ne mérites pas den manger dit lautre,A2
1264,jeune retraité de léducation nationale roger rougier a sa réponse,C1
1265,tout se passe bien en france ,B1
1266,non elle est fleuriste,A1
1267,sans enfants à cinquanteneuf ans guido avait de son propre coeur préparé pour son enfant à venir un coeur modelé sur sa propre préoccupation  lhommage sans remords à la noblesse la génuflexion que fait par contraction musculaire le corps pourchassé en saffalant devant ce qui est imminent et inaccessible comme devant une grande chaleur,C2
1268,le plat plein ploie sous le poids ou ne ploie point ,C2
1269,et vous lentendez ce violon qui joue du klezmer la musique traditionnelle des juifs itinérants ,B2
1270,un principe qui concerne déjà de nombreux produits tels que les emballages les textiles et les pneus,B2
1271,non bien sûr que non,A2
1272,jai une soeur,A1
1273,et jadresse un défi collectif au parterre ,B2
1274,en étant connecté en permanence à ses amis et en pouvant se raccrocher à des environnements en ligne familiers comme sa page facebook son compte twitter ou sa story snapchat la personne éloignée de son environnement familier ne se sentiraitelle pas alors davantage en sécurité affective comme dans son foyer où elle a ses repères et habitudes rassurants ,C2
1275,la blanquette est bonne,A2
1276,lempereur était à paris,B1
1277,je mappelle laurent et jhabite à paris avec mes parents ma soeur ainée et mon frère,A2
1278,puis il y eut une pause lugubre suivie dun vaste soupir dagonie où lon eût dit que lâme de la grosse cloche sexhalait,C2
1279,la règle du frein à lendettement devrait traiter de manière symétrique les dépassements de dépenses et les économies réalisées,C1
1280,la spirale vicieuse cette mécanique qui entraîne vers le bas nest pas dans le discours des milieux populaires liée à une conjoncture négative,B2
1281,ils ne se parlent plus depuis quils se sont disputés,B1
1282,pour yak rivais le langage fait certes travailler le cerveau mais aussi loeil et loreille,B2
1283,en brisant le fatum des itinéraires sociaux en augmentant le temps de la formation en accroissant lautonomie des individus les sociétés modernes ont inventé la jeunesse et celleci ne cesse de sallonger jusquà 25 ans et audelà,B2
1284,je ne me couche pas trop tard vers minuit,A1
1285,nous allons essayer à nouveau ndlr dentrer en contact avec lui mais les chances de rétablir la liaison sont très très faibles a déclaré à lafp stephan ulamec responsable de latterrisseur depuis lagence spatiale européenne esa à darmstadt allemagne,B2
1286,ajoutons pour parfaire ce tableau que ces seniors ont reçu de la science la perspective dun quart de siècle de longévité supplémentaire traversé en relative bonne santé,B2
1287,une fois ces déclencheurs identifiés il faut alors élaborer des stratégies pour les éviter ou y faire face,C2
1288,elles se réveillèrent très tôt hier matin afin de se rendre au tribunal pour plaider la cause de leurs maris injustement accusés descroquerie,C1
1289,après la transfusion le sang provenant dun don de sang complet ou dun don par aphérèse est congelé à une température de moins 30 degrés celsius et est mis en quarantaine,C2
1290,or peuton se contenter de cette expérience immédiate ou pour reprendre la formulation de bergson de cette donnée immédiate de la conscience,C2
1291,la compagnie qui le gère est à majorité anglaise,B1
1292,je profite aussi du petitdéjeuner pour lire les infos en ligne,A1
1293,toutefois ce système répond à des critères précis et exigeants difficilement compatibles avec le développement à grande échelle auquel il est appelé,C1
1294,oui la raison a pu saccommoder de la théologie païenne,C1
1295,confronté avec rien de pire quun général en cuir crissant et ces mouvements légèrement percutants qui sont communs aux personnages militaires lesquels semblent aspirer lair au dedans sentent la poudre à canon et la chair de cheval et bien que léthargiques ont lair prêts à participer à une guerre encore indéterminée type dhommes pour lequel hedwige sétait senti beaucoup dinclination guido avait été secoué dun tremblement invisible,C2
1296,cette action avait pour objectif dès lorigine daider les professeurs à enseigner la science et la technologie en mettant en oeuvre une pédagogie privilégiant lexpérimentation la discussion une pratique active et collective,C2
1297,elle portait une robe marron foncé qui moulait sa taille ses hanches sa gorge ses bras dune façon provocante et coquette  et duroy éprouvait un étonnement confus presque une gêne dont il ne saisissait pas bien la cause du désaccord de cette élégance soignée et raffinée avec linsouci visible pour le logis quelle habitait,C2
1298,les papyboomers sont individualistes ce sont dailleurs eux qui ont mis en vogue le concept,B2
1299,une politique de sécurité est un outil de gouvernance qui permet de traiter la sécurité comme un processus de gestion continu en fonction dobjectifs stratégiques clairement définis,C1
1300,tout le monde na pas largent pour se payer une machine à laver,B1
1301,lettres de motivation damour ou de rupture relecture de mémoires détudiant textes dhommage à lire et à distribuer pendant des obsèques situations administratives à démêler avec la banque les impôts ou la copropriété lécrivain public doit pouvoir répondre à toutes les demandes,C1
1302,et donc je te remercie pour tout ton boulot,A2
1303,elle se rendit compte quelle travaillait dans la pénombre et alluma la lampe posée sur le bureau,B2
1304,au premier étage il y a trois chambres,B1
1305,paul a le numéro de téléphone de marie,A1
1306,ils font à manger et ils nettoient toujours la cuisine juste après,A2
1307,elles font des cracracracracraaa  et moi jen fais autant  on samuse ,A2
1308,en 2001 rosalie a expliqué à lonu auprès du groupe de travail sur les peuples autochtones en quoi la survie des bisons sauvages est essentielle et symbolique pour les indiens des plaines,C1
1309,si tas trouvé le vidéo le fun pense à aimer notre chaine youtube et notre page facebook,C1
1310,par crainte des représailles les contestataires ont été moins nombreux mardi dans les rues,B2
1311,ce récit fascine toujours notre sciencefiction blade runner de ridley scott 1982 ou her de spike jonze 2013 en témoignent,B2
1312,mon énergie mon temps mon argent,A2
1313,questce que tu penses de cette peinture ,A1
1314,en france cest lenseignement catholique qui le premier a osé briser le tabou en rediscutant des vices et vertus de la mixité depuis ses assises de décembre 2000,C1
1315,si nous sommes bloqués dans lascenseur qui sest arrêté brusquement nous appellerons du secours dès que la communication sera établie,B2
1316,il vient de la racine slave robota qui signifie travail de force,C2
1317,il a donc rejeté tout changement de mode de scrutin qui introduirait des mécanismes partisans et abstraits dans ces collectivités où lappartenance politique des élus est fort peu prise en compte,C1
1318,mais les chocs pétroliers plongent la france dans la crise,C1
1319,ce texte invite les états à prendre toutes les mesures possibles dans la pratique pour veiller à ce que les membres de leurs forces armées qui nont pas atteint lâge de 18 ans ne participent pas directement aux hostilités art,B1
1320,vous êtes biologiste militante passionnée de cette pédagogie vous allez nous expliquer pourquoi le sujet vous passionne,C1
1321,souvent elle était rêveuse et taciturne  quelquefois elle parlait avec impétuosité,C2
1322,la dame ne vient pas,A1
1323,après cette crise qui se renouvelle toutes les nuits je dors enfin avec calme jusquà laurore,B2
1324,elle raconte leur quotidien à travers les enfants quelle a aussi aidés à faire leurs devoirs,A2
